{
  "$schema": "https://json-schema.org/draft/2020-12/schema",
  "$id": "https://ai-engineering-lab.local/schemas/evidence-bundle.schema.json",
  "title": "Engineering Evidence Bundle",
  "description": "Complete evidence package used to determine whether an engineering task is ready for human approval.",
  "type": "object",
  "additionalProperties": false,
  "required": [
    "schema_version",
    "task_id",
    "decision",
    "implementation",
    "verification",
    "findings",
    "generated_at"
  ],
  "properties": {
    "schema_version": {
      "type": "string",
      "const": "0.1"
    },
    "task_id": {
      "type": "string"
    },
    "decision": {
      "type": "string",
      "enum": [
        "pass",
        "fail",
        "needs_human"
      ]
    },
    "implementation": {
      "type": "object",
      "additionalProperties": false,
      "required": [
        "branch",
        "commit_sha"
      ],
      "properties": {
        "branch": {
          "type": "string"
        },
        "commit_sha": {
          "type": "string"
        },
        "pull_request": {
          "type": "integer"
        }
      }
    },
    "verification": {
      "type": "object",
      "additionalProperties": false,
      "required": [
        "checks",
        "all_required_checks_passed"
      ],
      "properties": {
        "checks": {
          "type": "array",
          "items": {
            "type": "object",
            "additionalProperties": false,
            "required": [
              "name",
              "status"
            ],
            "properties": {
              "name": {
                "type": "string"
              },
              "status": {
                "type": "string",
                "enum": [
                  "passed",
                  "failed",
                  "skipped"
                ]
              },
              "source": {
                "type": "string"
              }
            }
          }
        },
        "all_required_checks_passed": {
          "type": "boolean"
        }
      }
    },
    "findings": {
      "type": "array",
      "items": {
        "$ref": "finding.schema.json"
      }
    },
    "acceptance_criteria": {
      "type": "array",
      "items": {
        "type": "object",
        "additionalProperties": false,
        "required": [
          "criterion_id",
          "status"
        ],
        "properties": {
          "criterion_id": {
            "type": "string"
          },
          "status": {
            "type": "string",
            "enum": [
              "passed",
              "failed",
              "not_verified"
            ]
          },
          "evidence": {
            "type": "string"
          }
        }
      }
    },
    "reviewers": {
      "type": "array",
      "items": {
        "type": "object",
        "additionalProperties": false,
        "required": [
          "agent",
          "decision"
        ],
        "properties": {
          "agent": {
            "type": "string"
          },
          "decision": {
            "type": "string",
            "enum": [
              "approve",
              "reject",
              "comment"
            ]
          },
          "finding_ids": {
            "type": "array",
            "items": {
              "type": "string"
            }
          }
        }
      }
    },
    "generated_at": {
      "type": "string",
      "format": "date-time"
    }
  }
}